{
  "schema_version": "wikiconv-source-action-feasibility/0.1.0",
  "status": "blank_unannotated",
  "study_scope": "local_frozen_sample_measurement_feasibility",
  "automatic_H_G_conversion": false,
  "population_fitting_permitted": false,
  "natural_author_links_verified": 0,
  "empirical_temporal_episodes_admitted": 0,
  "annotation_provenance": "assistant_generated_not_independent_human_gold",
  "source_views": [],
  "content_reviews": [],
  "contexts": [],
  "action_units": [],
  "referential_packet_ref": null,
  "notes": [
    "Blank feasibility template. No corpus text, identifiers, labels, events or independent judgments are represented."
  ]
}
